{
  "schemaVersion": 2,
  "implementationHash": "sha256:711704ec7186e0030e3acca62ee0b92dd316e404835bc7474111d63271ab5dff",
  "captureContractHash": "sha256:c2082c7da07fafad21440daa61dde3a20e20dfd7f03e9dcf6af61c9042fe26f9",
  "taskId": "pricing-dashboard",
  "caseId": "pricing-selector-desktop-default-behavior-only",
  "fileKey": "AbCdEfGhIjKlMnOpQrStUv",
  "fileVersion": "1234567890123456789",
  "nodeId": "12:34",
  "route": "/pricing",
  "viewport": {
    "width": 1440,
    "height": 900,
    "dpr": 1
  },
  "state": "default",
  "evidenceMode": "behavior-only",
  "actions": [
    "Открыта страница /pricing",
    "Переключатель периода оплаты активирован с клавиатуры"
  ],
  "assertions": [
    {
      "kind": "keyboard",
      "selector": "[data-testid='pricing-toggle']",
      "expected": "Enter меняет период оплаты",
      "actual": "Период оплаты изменён, состояние переключателя обновлено",
      "status": "passed"
    },
    {
      "kind": "focus",
      "selector": "[data-testid='pricing-toggle']",
      "expected": "После Tab виден индикатор фокуса",
      "actual": "Индикатор фокуса виден и не перекрыт",
      "status": "passed"
    },
    {
      "kind": "accessible-name",
      "selector": "[data-testid='pricing-toggle']",
      "expected": "Доступное имя описывает выбор периода оплаты",
      "actual": "Имя элемента: Период оплаты",
      "status": "passed"
    },
    {
      "kind": "contrast",
      "selector": "[data-testid='pricing-toggle']",
      "expected": "Текст и состояния проходят установленный порог контраста",
      "actual": "Проверка контраста прошла без нарушений",
      "status": "passed"
    }
  ],
  "consoleErrors": [],
  "pageErrors": [],
  "status": "passed"
}
